id,title,budget,keywords,genres,release_date,original_language,director,writer,compositor,main_actors,runtime,vote_average,vote_count,poster_path,overview
299534,Avengers : Endgame,500000000,space_travel time_travel time_machine quantum_mechanics sequel superhero based_on_comic space alien_invasion superhero_team,Aventure Science-Fiction Action,2019-04-24,en,Joe_Russo,Christopher_Markus,Alan_Silvestri,Robert_Downey_Jr. Chris_Evans Mark_Ruffalo Chris_Hemsworth Scarlett_Johansson,180,88.0,1578,https://image.tmdb.org/t/p/original/zEGv6yg9G19yqdvMo2dQy2OqKCI.jpg,"Après leur défaite face au Titan Thanos qui dans le film précédent s'est approprié toutes les pierres du Gant de l'infini , les Avengers et les Gardiens de la Galaxie ayant survécu à son claquement de doigts qui a pulvérisé « la moitié de toute forme de vie dans l'Univers », Captain America, Thor, Bruce Banner, Natasha Romanoff, War Machine, Tony Stark, Nébula et Rocket, vont essayer de trouver une solution pour ramener leurs coéquipiers disparus et vaincre Thanos en se faisant aider par Ronin alias Clint Barton, Captain Marvel et Ant-Man."
456740,Hellboy,50000000,witch supernatural superhero,Action Aventure Fantastique,2019-04-10,en,Neil_Marshall,Andrew_Cosby,Benjamin_Wallfisch,David_Harbour Milla_Jovovich Ian_McShane Daniel_Dae_Kim Sasha_Lane,121,52.0,248,https://image.tmdb.org/t/p/original/yGBRuTkXMUPv2mCrBtWBjJIgYX3.jpg,"Hellboy affronte Nimue, épouse de Merlin et Reine de Sang. Leur lutte amorcera la fin du monde, un sort que le héros devra éviter à tout prix."
537915,After - chapitre I,0,based_on_novel_or_book love teenage_crush saga after,Drame Romance,2019-04-11,en,Jenny_Gage,Anna_Todd,,Josephine_Langford Hero_Fiennes_Tiffin Selma_Blair Jennifer_Beals Peter_Gallagher,106,65.0,570,https://image.tmdb.org/t/p/original/u3B2YKUjWABcxXZ6Nm9h10hLUbh.jpg,"Depuis son plus jeune âge, Tessa était promise à un avenir tout tracé : une vie rangée, une brillante carrière, un mariage tranquille avec son fiancé de toujours. Jusqu’à sa rencontre avec Hardin à son arrivée à l’université.Grossier, provocateur, cruel, c’est le garçon le plus détestable qu’elle ait jamais croisé. Et pourtant, ce bad boy tatoué pourrait bien lui faire perdre tout contrôle…"
287947,Shazam!,80000000,philadelphia dc_comics secret_identity magic superhero based_on_comic wizard superhuman_strength aftercreditsstinger duringcreditsstinger,Comédie Aventure Fantastique,2019-03-23,en,David_F._Sandberg,Henry_Gayden,Benjamin_Wallfisch,Zachary_Levi Jack_Dylan_Grazer Mark_Strong Asher_Angel Djimon_Hounsou,132,72.0,1240,https://image.tmdb.org/t/p/original/xnopI5Xtky18MPhK40cZAGAOVeV.jpg,"On a tous un super-héros qui sommeille au fond de soi… il faut juste un peu de magie pour le réveiller. Pour Billy Batson, gamin débrouillard de 14 ans lacé dans une famille d'accueil, il suffit de crier 'Shazam !' pour se transformer en super-héros. Ado dans un corps d'adulte sculpté à la perfection, Shazam s'éclate avec ses tout nouveaux superpouvoirs. Est-il capable de voler ? De voir à travers n'importe quel type de matière ? De faire jaillir la foudre de ses mains ? Et de sauter son examen de sciences sociales ? Shazam repousse les limites de ses facultés avec l'insouciance d'un enfant. Mais il lui faudra maîtriser rapidement ses pouvoirs pour combattre les forces des ténèbres du Dr Thaddeus Sivana…"
487297,What Men Want,20000000,,Comédie Fantastique Romance,2019-02-08,en,Adam_Shankman,Tina_Gordon_Chism,,Taraji_P._Henson Tracy_Morgan Aldis_Hodge Wendi_McLendon-Covey Kristen_Ledlow,117,57.0,165,https://image.tmdb.org/t/p/original/30IiwvIRqPGjUV0bxJkZfnSiCL.jpg,"Une femme agent sportif, rejetée par ses collègues masculins, décide de tout faire, maintenant qu'elle peut lire dans l'esprits des hommes, pour embaucher la prochaine superstar du basket."
166428,Dragons 3 : Le monde caché,129000000,flying based_on_novel_or_book overpopulation viking finale sequel cgi dragon based_on_children's_book,Animation Familial Aventure,2019-01-03,en,Dean_DeBlois,Dean_DeBlois,John_Powell,Jay_Baruchel America_Ferrera F._Murray_Abraham Cate_Blanchett,104,76.0,1602,https://image.tmdb.org/t/p/original/lsifceBTpDx1KsdVtC2Xh1XQAgc.jpg,"Ce qui avait commencé comme une amitié improbable entre un jeune Viking et un redoutable dragon Fury Nocturne est devenu une épique trilogie retraçant leurs vies. Dans ce nouveau chapitre, Harold et Krokmou vont enfin découvrir leurs véritables destinées : être le chef de Berk au côté d’Astrid et, en tant que dragon, être le leader de son espèce. Alors qu’ils réalisent leurs rêves de vivre en paix entre Vikings et dragons, une sombre menace planant sur le village et l’apparition d’une femelle Fury Nocturne vont mettre à mal leurs liens d’amitié comme jamais auparavant."
480414,La Malédiction de la Dame Blanche,0,the_conjuring_universe,Thriller Horreur Mystère,2019-04-17,en,Michael_Chaves,Mikki_Daughtry,Joseph_Bishara,Linda_Cardellini Raymond_Cruz Marisol_Ramirez Patricia_Velásquez Sean_Patrick_Thomas,93,54.0,159,https://image.tmdb.org/t/p/original/xLF5xA1ehNnWLj9p9PdbM7LH8oi.jpg,"Quand elle était en vie, elle a noyé ses enfants dans un accès de folle jalousie, puis, dévastée par le chagrin, elle s'est jetée dans le fleuve déchaîné.  Désormais, ses larmes sont devenues éternelles. Elles sont même mortelles et tous ceux qui entendent ses appels sinistres la nuit sont maudits. Tapie dans l'ombre, la 'Llorana' s'attaque aux enfants, cherchant désespérément à remplacer les siens. Au fil des siècles, elle est devenue de plus en plus prédatrice… et ses méthodes de plus en plus terrifiantes.  Los Angeles, années 1970. La Llorana hante la nuit… et les enfants.  Ignorant les avertissements d'une mère soupçonnée de violence sur mineurs, une assistante sociale et ses enfants sont projetés dans un monde surnaturel des plus effrayants. Pour espérer survivre à la fureur mortelle de la Llorana, leur seul recours est un prêtre désabusé et ses pratiques mystiques destinées à repousser les forces du mal… à la frontière où la peur et la foi se rencontrent…"
